No.     Time           Source                Destination           Protocol Info
    156 14.121164317   Espressi_0d:83:08     Broadcast             ARP      Who has 192.168.0.102? Tell 192.168.0.101

Frame 156: 42 bytes on wire (336 bits), 42 bytes captured (336 bits) on interface 0
Ethernet II, Src: Espressi_0d:83:08 (3c:71:bf:0d:83:08), Dst: Broadcast (ff:ff:ff:ff:ff:ff)
Address Resolution Protocol (request)

No.     Time           Source                Destination           Protocol Info
    157 14.121188507   EdimaxTe_6a:d6:79     Espressi_0d:83:08     ARP      192.168.0.102 is at 74:da:38:6a:d6:79

Frame 157: 42 bytes on wire (336 bits), 42 bytes captured (336 bits) on interface 0
Ethernet II, Src: EdimaxTe_6a:d6:79 (74:da:38:6a:d6:79), Dst: Espressi_0d:83:08 (3c:71:bf:0d:83:08)
Address Resolution Protocol (reply)

No.     Time           Source                Destination           Protocol Info
    158 14.122107994   Espressi_0d:83:08     Broadcast             ARP      Gratuitous ARP for 192.168.0.101 (Request)

Frame 158: 42 bytes on wire (336 bits), 42 bytes captured (336 bits) on interface 0
Ethernet II, Src: Espressi_0d:83:08 (3c:71:bf:0d:83:08), Dst: Broadcast (ff:ff:ff:ff:ff:ff)
Address Resolution Protocol (request/gratuitous ARP)

No.     Time           Source                Destination           Protocol Info
    159 14.122964480   Espressi_0d:83:08     Broadcast             ARP      Who has 192.168.0.102? Tell 192.168.0.101

Frame 159: 42 bytes on wire (336 bits), 42 bytes captured (336 bits) on interface 0
Ethernet II, Src: Espressi_0d:83:08 (3c:71:bf:0d:83:08), Dst: Broadcast (ff:ff:ff:ff:ff:ff)
Address Resolution Protocol (request)

No.     Time           Source                Destination           Protocol Info
    160 14.122984496   EdimaxTe_6a:d6:79     Espressi_0d:83:08     ARP      192.168.0.102 is at 74:da:38:6a:d6:79

Frame 160: 42 bytes on wire (336 bits), 42 bytes captured (336 bits) on interface 0
Ethernet II, Src: EdimaxTe_6a:d6:79 (74:da:38:6a:d6:79), Dst: Espressi_0d:83:08 (3c:71:bf:0d:83:08)
Address Resolution Protocol (reply)

No.     Time           Source                Destination           Protocol Info
    161 14.938813689   192.168.0.101         192.168.0.102         TCP      5004 → 5005 [SYN] Seq=0 Win=5744 Len=0 MSS=1436

Frame 161: 58 bytes on wire (464 bits), 58 bytes captured (464 bits) on interface 0
Ethernet II, Src: Espressi_0d:83:08 (3c:71:bf:0d:83:08), Dst: EdimaxTe_6a:d6:79 (74:da:38:6a:d6:79)
Internet Protocol Version 4, Src: 192.168.0.101, Dst: 192.168.0.102
Transmission Control Protocol, Src Port: 5004, Dst Port: 5005, Seq: 0, Len: 0

No.     Time           Source                Destination           Protocol Info
    162 14.938871577   192.168.0.102         192.168.0.101         TCP      5005 → 5004 [SYN, ACK] Seq=0 Ack=1 Win=64240 Len=0 MSS=1460

Frame 162: 58 bytes on wire (464 bits), 58 bytes captured (464 bits) on interface 0
Ethernet II, Src: EdimaxTe_6a:d6:79 (74:da:38:6a:d6:79), Dst: Espressi_0d:83:08 (3c:71:bf:0d:83:08)
Internet Protocol Version 4, Src: 192.168.0.102, Dst: 192.168.0.101
Transmission Control Protocol, Src Port: 5005, Dst Port: 5004, Seq: 0, Ack: 1, Len: 0

No.     Time           Source                Destination           Protocol Info
    163 14.943208461   192.168.0.101         192.168.0.102         TCP      5004 → 5005 [ACK] Seq=1 Ack=1 Win=5744 Len=0

Frame 163: 54 bytes on wire (432 bits), 54 bytes captured (432 bits) on interface 0
Ethernet II, Src: Espressi_0d:83:08 (3c:71:bf:0d:83:08), Dst: EdimaxTe_6a:d6:79 (74:da:38:6a:d6:79)
Internet Protocol Version 4, Src: 192.168.0.101, Dst: 192.168.0.102
Transmission Control Protocol, Src Port: 5004, Dst Port: 5005, Seq: 1, Ack: 1, Len: 0

No.     Time           Source                Destination           Protocol Info
    164 14.944031760   192.168.0.101         192.168.0.102         TCP      5004 → 5005 [PSH, ACK] Seq=1 Ack=1 Win=5744 Len=4

Frame 164: 58 bytes on wire (464 bits), 58 bytes captured (464 bits) on interface 0
Ethernet II, Src: Espressi_0d:83:08 (3c:71:bf:0d:83:08), Dst: EdimaxTe_6a:d6:79 (74:da:38:6a:d6:79)
Internet Protocol Version 4, Src: 192.168.0.101, Dst: 192.168.0.102
Transmission Control Protocol, Src Port: 5004, Dst Port: 5005, Seq: 1, Ack: 1, Len: 4
Data (4 bytes)

0000  48 65 6c 6c                                       Hell

No.     Time           Source                Destination           Protocol Info
    165 14.944063298   192.168.0.102         192.168.0.101         TCP      5005 → 5004 [ACK] Seq=1 Ack=5 Win=64236 Len=0

Frame 165: 54 bytes on wire (432 bits), 54 bytes captured (432 bits) on interface 0
Ethernet II, Src: EdimaxTe_6a:d6:79 (74:da:38:6a:d6:79), Dst: Espressi_0d:83:08 (3c:71:bf:0d:83:08)
Internet Protocol Version 4, Src: 192.168.0.102, Dst: 192.168.0.101
Transmission Control Protocol, Src Port: 5005, Dst Port: 5004, Seq: 1, Ack: 5, Len: 0
